{
  "caseId": "CASE_ID",
  "caseUrn": "CASE_URN",
  "prosecutionAuthority": "CPS",
  "defendants": [
    {
      "id": "DEFENDANT_ID1",
      "bailStatus": "REMAND",
      "interpreterLanguage": "German",
      "hearings": [
        {
          "courtCentre": "Southwark",
          "hearingDate": "2025-01-21"
        }
      ],
      "defendantPerson": {
        "forename": "John",
        "middleName": "Theodore",
        "surname": "SMITH",
        "dateOfBirth": "1970-02-03"
      },
      "offencesDetails": {
        "addedOffences": [
          {
            "offenceId": "26a5a426-3d87-45a9-b079-0830ed0229db"
          }
        ],
        "removedOffences": [
          {
            "offenceId": "36a5a426-3d87-45a9-b079-0830ed0229db"
          }
        ]
      }
    },
    {
      "id": "DEFENDANT_ID2",
      "bailStatus": "REMAND",
      "interpreterLanguage": "German",
      "hearings": [
        {
          "courtCentre": "Southwark",
          "hearingDate": "2025-01-21"
        }
      ],
      "defendantPerson": {
        "forename": "Johnq",
        "middleName": "Theodore",
        "surname": "SMITHq",
        "dateOfBirth": "1971-02-03"
      },
      "offencesDetails": {
        "addedOffences": [
          {
            "offenceId": "36a5a426-3d87-45a9-b079-0830ed0229db"
          }
        ]
      }
    }
  ]
}